{
    "id": "2427b280-a5cf-4dfd-9d4c-d06cd9e7faa1",
    "task_name": "ccx-platform-119",
    "trial_name": "ccx-platform-119__eWBrL7w",
    "trial_uri": "file:///home/stephanie_jarmak/CodeContextBench/runs/staging/ccb_mcp_platform_haiku_20260302_175827/baseline-local-direct/2026-03-02__18-11-40/ccx-platform-119__eWBrL7w",
    "task_id": {
        "path": "/home/stephanie_jarmak/CodeContextBench/configs/../benchmarks/ccb_mcp_platform/ccx-platform-119"
    },
    "source": null,
    "task_checksum": "853171d2043fb0f3e3bf2af3f47c49b42e8887698d742937c72b3a8898c49a12",
    "config": {
        "task": {
            "path": "/home/stephanie_jarmak/CodeContextBench/configs/../benchmarks/ccb_mcp_platform/ccx-platform-119",
            "git_url": null,
            "git_commit_id": null,
            "overwrite": false,
            "download_dir": null,
            "source": null
        },
        "trial_name": "ccx-platform-119__eWBrL7w",
        "trials_dir": "runs/staging/ccb_mcp_platform_haiku_20260302_175827/baseline-local-direct/2026-03-02__18-11-40",
        "timeout_multiplier": 10.0,
        "agent_timeout_multiplier": null,
        "verifier_timeout_multiplier": null,
        "agent_setup_timeout_multiplier": null,
        "environment_build_timeout_multiplier": null,
        "agent": {
            "name": null,
            "import_path": "agents.claude_baseline_agent:BaselineClaudeCodeAgent",
            "model_name": "anthropic/claude-haiku-4-5-20251001",
            "override_timeout_sec": null,
            "override_setup_timeout_sec": null,
            "max_timeout_sec": null,
            "kwargs": {},
            "env": {}
        },
        "environment": {
            "type": "daytona",
            "import_path": null,
            "force_build": false,
            "delete": true,
            "override_cpus": null,
            "override_memory_mb": null,
            "override_storage_mb": 10240,
            "override_gpus": null,
            "suppress_override_warnings": false,
            "kwargs": {}
        },
        "verifier": {
            "override_timeout_sec": null,
            "max_timeout_sec": null,
            "disable": false
        },
        "artifacts": [],
        "job_id": "d12efbf9-c4d2-41cb-8c21-53427b45e28a"
    },
    "agent_info": {
        "name": "claude-code",
        "version": "unknown",
        "model_info": {
            "name": "claude-haiku-4-5-20251001",
            "provider": "anthropic"
        }
    },
    "agent_result": {
        "n_input_tokens": 1474907,
        "n_cache_tokens": 1474356,
        "n_output_tokens": 9400,
        "cost_usd": null,
        "rollout_details": null,
        "metadata": null
    },
    "verifier_result": {
        "rewards": {
            "reward": 0.35
        }
    },
    "exception_info": null,
    "started_at": "2026-03-02T18:11:40.954761Z",
    "finished_at": "2026-03-02T18:13:39.812115Z",
    "environment_setup": {
        "started_at": "2026-03-02T18:11:40.982645Z",
        "finished_at": "2026-03-02T18:11:42.307973Z"
    },
    "agent_setup": {
        "started_at": "2026-03-02T18:11:42.308008Z",
        "finished_at": "2026-03-02T18:11:58.096257Z"
    },
    "agent_execution": {
        "started_at": "2026-03-02T18:11:58.096325Z",
        "finished_at": "2026-03-02T18:13:35.693556Z"
    },
    "verifier": {
        "started_at": "2026-03-02T18:13:36.805124Z",
        "finished_at": "2026-03-02T18:13:38.557776Z"
    }
}