{
    "id": "22f474b5-5f41-4ae5-a99e-1b98f7dc2a97",
    "task_name": "openlibrary-fntocli-adapter-fix-001",
    "trial_name": "openlibrary-fntocli-adapter-fix-__JyVebga",
    "trial_uri": "file:///home/stephanie_jarmak/CodeContextBench/runs/staging/ccb_fix_haiku_20260302_013712/baseline-local-direct/2026-03-02__01-37-22/openlibrary-fntocli-adapter-fix-__JyVebga",
    "task_id": {
        "path": "/home/stephanie_jarmak/CodeContextBench/configs/../benchmarks/ccb_fix/openlibrary-fntocli-adapter-fix-001"
    },
    "source": null,
    "task_checksum": "ef593784e85acb02277fe3b7d2910628b6eca0bc002752cc51d291f2dc6edf0a",
    "config": {
        "task": {
            "path": "/home/stephanie_jarmak/CodeContextBench/configs/../benchmarks/ccb_fix/openlibrary-fntocli-adapter-fix-001",
            "git_url": null,
            "git_commit_id": null,
            "overwrite": false,
            "download_dir": null,
            "source": null
        },
        "trial_name": "openlibrary-fntocli-adapter-fix-__JyVebga",
        "trials_dir": "runs/staging/ccb_fix_haiku_20260302_013712/baseline-local-direct/2026-03-02__01-37-22",
        "timeout_multiplier": 10.0,
        "agent_timeout_multiplier": null,
        "verifier_timeout_multiplier": null,
        "agent_setup_timeout_multiplier": null,
        "environment_build_timeout_multiplier": null,
        "agent": {
            "name": null,
            "import_path": "agents.claude_baseline_agent:BaselineClaudeCodeAgent",
            "model_name": "anthropic/claude-haiku-4-5-20251001",
            "override_timeout_sec": null,
            "override_setup_timeout_sec": null,
            "max_timeout_sec": null,
            "kwargs": {},
            "env": {}
        },
        "environment": {
            "type": "docker",
            "import_path": null,
            "force_build": false,
            "delete": true,
            "override_cpus": null,
            "override_memory_mb": null,
            "override_storage_mb": null,
            "override_gpus": null,
            "suppress_override_warnings": false,
            "kwargs": {}
        },
        "verifier": {
            "override_timeout_sec": null,
            "max_timeout_sec": null,
            "disable": false
        },
        "artifacts": [],
        "job_id": "83623e24-d744-422d-9e90-c46d4af148a0"
    },
    "agent_info": {
        "name": "claude-code",
        "version": "unknown",
        "model_info": {
            "name": "claude-haiku-4-5-20251001",
            "provider": "anthropic"
        }
    },
    "agent_result": {
        "n_input_tokens": 1019315,
        "n_cache_tokens": 1018896,
        "n_output_tokens": 5596,
        "cost_usd": null,
        "rollout_details": null,
        "metadata": null
    },
    "verifier_result": {
        "rewards": {
            "reward": 0.6667
        }
    },
    "exception_info": null,
    "started_at": "2026-03-02T01:37:22.439401Z",
    "finished_at": "2026-03-02T01:39:36.126806Z",
    "environment_setup": {
        "started_at": "2026-03-02T01:37:22.440269Z",
        "finished_at": "2026-03-02T01:37:24.297954Z"
    },
    "agent_setup": {
        "started_at": "2026-03-02T01:37:24.297991Z",
        "finished_at": "2026-03-02T01:38:16.849734Z"
    },
    "agent_execution": {
        "started_at": "2026-03-02T01:38:16.849782Z",
        "finished_at": "2026-03-02T01:39:24.329575Z"
    },
    "verifier": {
        "started_at": "2026-03-02T01:39:24.329639Z",
        "finished_at": "2026-03-02T01:39:25.105748Z"
    }
}