{
    "id": "c31ecf91-b5b0-420f-9cb6-54ba1cc093de",
    "task_name": "mcp_CCX-vuln-remed-141_Yxm9r9",
    "trial_name": "mcp_CCX-vuln-remed-141_Yxm9r9__DW9Z4mr",
    "trial_uri": "file:///home/stephanie_jarmak/CodeContextBench/runs/staging/ccb_mcp_security_haiku_20260224_170834/mcp-remote-artifact/2026-02-24__17-18-51/mcp_CCX-vuln-remed-141_Yxm9r9__DW9Z4mr",
    "task_id": {
        "path": "/tmp/mcp_CCX-vuln-remed-141_Yxm9r9"
    },
    "source": null,
    "task_checksum": "7ab9512d4c3a51541e916fd3c26ddad819a3027853d426955aea01c51500f234",
    "config": {
        "task": {
            "path": "/tmp/mcp_CCX-vuln-remed-141_Yxm9r9",
            "git_url": null,
            "git_commit_id": null,
            "overwrite": false,
            "download_dir": null,
            "source": null
        },
        "trial_name": "mcp_CCX-vuln-remed-141_Yxm9r9__DW9Z4mr",
        "trials_dir": "runs/staging/ccb_mcp_security_haiku_20260224_170834/mcp-remote-artifact/2026-02-24__17-18-51",
        "timeout_multiplier": 10.0,
        "agent": {
            "name": null,
            "import_path": "agents.claude_baseline_agent:BaselineClaudeCodeAgent",
            "model_name": "anthropic/claude-haiku-4-5-20251001",
            "override_timeout_sec": null,
            "override_setup_timeout_sec": null,
            "max_timeout_sec": null,
            "kwargs": {}
        },
        "environment": {
            "type": "docker",
            "import_path": null,
            "force_build": false,
            "delete": true,
            "override_cpus": null,
            "override_memory_mb": null,
            "override_storage_mb": null,
            "override_gpus": null,
            "kwargs": {}
        },
        "verifier": {
            "override_timeout_sec": null,
            "max_timeout_sec": null,
            "disable": false
        },
        "job_id": "faa9fa54-dd76-43a5-a869-4a7be1260d0b"
    },
    "agent_info": {
        "name": "claude-code",
        "version": "unknown",
        "model_info": {
            "name": "claude-haiku-4-5-20251001",
            "provider": "anthropic"
        }
    },
    "agent_result": {
        "n_input_tokens": 2858414,
        "n_cache_tokens": 2857912,
        "n_output_tokens": 101,
        "cost_usd": null,
        "rollout_details": null,
        "metadata": null
    },
    "verifier_result": {
        "rewards": {
            "reward": 0.0
        }
    },
    "exception_info": null,
    "started_at": "2026-02-24T17:18:51.547228",
    "finished_at": "2026-02-24T17:21:10.932020",
    "environment_setup": {
        "started_at": "2026-02-24T17:18:51.548147",
        "finished_at": "2026-02-24T17:18:54.985187"
    },
    "agent_setup": {
        "started_at": "2026-02-24T17:18:54.985222",
        "finished_at": "2026-02-24T17:19:28.964593"
    },
    "agent_execution": {
        "started_at": "2026-02-24T17:19:28.964624",
        "finished_at": "2026-02-24T17:20:59.996519"
    },
    "verifier": {
        "started_at": "2026-02-24T17:20:59.996580",
        "finished_at": "2026-02-24T17:21:00.221295"
    }
}