{
    "id": "71a54cff-91e8-47f7-8023-ff061876e96d",
    "task_name": "mcp_django-legacy-dep-vuln-001_vvhlhm",
    "trial_name": "mcp_django-legacy-dep-vuln-001_v__AMgjXja",
    "trial_uri": "file:///home/user/CodeScaleBench/runs/staging/csb_sdlc_secure_haiku_20260321_223701/mcp-remote-direct/2026-03-22__00-36-51/mcp_django-legacy-dep-vuln-001_v__AMgjXja",
    "task_id": {
        "path": "/tmp/mcp_django-legacy-dep-vuln-001_vvhlhm"
    },
    "source": null,
    "task_checksum": "acc71ccf43881b303b9903612f4c2e5b5bc18c2ece89318ccee2fe15d3e15521",
    "config": {
        "task": {
            "path": "/tmp/mcp_django-legacy-dep-vuln-001_vvhlhm",
            "git_url": null,
            "git_commit_id": null,
            "overwrite": false,
            "download_dir": null,
            "source": null
        },
        "trial_name": "mcp_django-legacy-dep-vuln-001_v__AMgjXja",
        "trials_dir": "runs/staging/csb_sdlc_secure_haiku_20260321_223701/mcp-remote-direct/2026-03-22__00-36-51",
        "timeout_multiplier": 10.0,
        "agent_timeout_multiplier": null,
        "verifier_timeout_multiplier": null,
        "agent_setup_timeout_multiplier": null,
        "environment_build_timeout_multiplier": null,
        "agent": {
            "name": null,
            "import_path": "agents.claude_baseline_agent:BaselineClaudeCodeAgent",
            "model_name": "anthropic/claude-haiku-4-5-20251001",
            "override_timeout_sec": null,
            "override_setup_timeout_sec": null,
            "max_timeout_sec": null,
            "kwargs": {},
            "env": {}
        },
        "environment": {
            "type": null,
            "import_path": "ccb_harbor.daytona:GuardedDaytonaEnvironment",
            "force_build": false,
            "delete": true,
            "override_cpus": null,
            "override_memory_mb": null,
            "override_storage_mb": null,
            "override_gpus": null,
            "suppress_override_warnings": false,
            "kwargs": {
                "label_launcher": "run_selected_tasks.sh",
                "label_run_id": "csb_sdlc_secure_haiku_20260321_223701",
                "label_benchmark": "csb_sdlc_secure",
                "label_task_id": "django-legacy-dep-vuln-001",
                "label_config": "mcp-remote-direct",
                "label_category": "staging",
                "label_model": "anthropic/claude-haiku-4-5-20251001",
                "label_mcp_type": "sourcegraph_full",
                "task_source_dir": "/home/user/CodeScaleBench/configs/harnesses/../../benchmarks/csb_sdlc_secure/django-legacy-dep-vuln-001"
            }
        },
        "verifier": {
            "override_timeout_sec": null,
            "max_timeout_sec": null,
            "disable": false
        },
        "artifacts": [],
        "job_id": "3a600f0d-17e1-4741-b2af-249d23f1763a"
    },
    "agent_info": {
        "name": "claude-code",
        "version": "unknown",
        "model_info": {
            "name": "claude-haiku-4-5-20251001",
            "provider": "anthropic"
        }
    },
    "agent_result": {
        "n_input_tokens": 9682197,
        "n_cache_tokens": 9681832,
        "n_output_tokens": 16718,
        "cost_usd": null,
        "rollout_details": null,
        "metadata": null
    },
    "verifier_result": {
        "rewards": {
            "reward": 0.9
        }
    },
    "exception_info": null,
    "started_at": "2026-03-22T00:36:51.333864Z",
    "finished_at": "2026-03-22T00:42:11.354940Z",
    "environment_setup": {
        "started_at": "2026-03-22T00:36:51.334635Z",
        "finished_at": "2026-03-22T00:36:52.920889Z"
    },
    "agent_setup": {
        "started_at": "2026-03-22T00:36:52.920939Z",
        "finished_at": "2026-03-22T00:37:16.493511Z"
    },
    "agent_execution": {
        "started_at": "2026-03-22T00:37:16.493556Z",
        "finished_at": "2026-03-22T00:41:08.899793Z"
    },
    "verifier": {
        "started_at": "2026-03-22T00:41:12.876939Z",
        "finished_at": "2026-03-22T00:42:10.030126Z"
    }
}