{
    "id": "373f9c2d-9577-46ee-9b6e-68e2af39b47d",
    "task_name": "django-select-for-update-fix-001",
    "trial_name": "django-select-for-update-fix-001__D2ZALxE",
    "trial_uri": "file:///home/stephanie_jarmak/CodeScaleBench/runs/staging/openhands_sonnet46_20260310_164503/baseline-local-direct/2026-03-10__16-45-19/django-select-for-update-fix-001__D2ZALxE",
    "task_id": {
        "path": "benchmarks/csb_sdlc_fix/django-select-for-update-fix-001"
    },
    "source": null,
    "task_checksum": "d8467fcaccca0954613716332f21be6ec109dc5ae45b2ce423f655c7b27f453a",
    "config": {
        "task": {
            "path": "benchmarks/csb_sdlc_fix/django-select-for-update-fix-001",
            "git_url": null,
            "git_commit_id": null,
            "overwrite": false,
            "download_dir": null,
            "source": null
        },
        "trial_name": "django-select-for-update-fix-001__D2ZALxE",
        "trials_dir": "runs/staging/openhands_sonnet46_20260310_164503/baseline-local-direct/2026-03-10__16-45-19",
        "timeout_multiplier": 10.0,
        "agent_timeout_multiplier": null,
        "verifier_timeout_multiplier": null,
        "agent_setup_timeout_multiplier": null,
        "environment_build_timeout_multiplier": null,
        "agent": {
            "name": null,
            "import_path": "agents.harnesses.openhands:OpenHandsHarnessAgent",
            "model_name": "anthropic/claude-sonnet-4-6",
            "override_timeout_sec": null,
            "override_setup_timeout_sec": null,
            "max_timeout_sec": null,
            "kwargs": {},
            "env": {}
        },
        "environment": {
            "type": null,
            "import_path": "ccb_harbor.daytona:GuardedDaytonaEnvironment",
            "force_build": false,
            "delete": true,
            "override_cpus": null,
            "override_memory_mb": null,
            "override_storage_mb": 10240,
            "override_gpus": null,
            "suppress_override_warnings": false,
            "kwargs": {
                "label_launcher": "openhands_2config.sh",
                "label_run_id": "openhands_sonnet46_20260310_164503",
                "label_benchmark": "csb_sdlc_fix",
                "label_task_id": "django-select-for-update-fix-001",
                "label_config": "baseline-local-direct",
                "label_category": "staging",
                "label_model": "anthropic/claude-sonnet-4-6",
                "label_mcp_type": "none",
                "task_source_dir": "benchmarks/csb_sdlc_fix/django-select-for-update-fix-001"
            }
        },
        "verifier": {
            "override_timeout_sec": null,
            "max_timeout_sec": null,
            "disable": false
        },
        "artifacts": [],
        "job_id": "470dfa78-bf66-496f-b5f4-45916185375e"
    },
    "agent_info": {
        "name": "openhands",
        "version": "unknown",
        "model_info": {
            "name": "claude-sonnet-4-6",
            "provider": "anthropic"
        }
    },
    "agent_result": {
        "n_input_tokens": 1967712,
        "n_cache_tokens": 1866140,
        "n_output_tokens": 23492,
        "cost_usd": 1.2824302499999995,
        "rollout_details": null,
        "metadata": null
    },
    "verifier_result": {
        "rewards": {
            "reward": 0.65
        }
    },
    "exception_info": null,
    "started_at": "2026-03-10T16:45:19.607253Z",
    "finished_at": "2026-03-10T16:55:24.047360Z",
    "environment_setup": {
        "started_at": "2026-03-10T16:45:19.608169Z",
        "finished_at": "2026-03-10T16:45:20.784572Z"
    },
    "agent_setup": {
        "started_at": "2026-03-10T16:45:20.784608Z",
        "finished_at": "2026-03-10T16:45:50.481340Z"
    },
    "agent_execution": {
        "started_at": "2026-03-10T16:45:50.481406Z",
        "finished_at": "2026-03-10T16:55:10.087333Z"
    },
    "verifier": {
        "started_at": "2026-03-10T16:55:19.894241Z",
        "finished_at": "2026-03-10T16:55:22.754058Z"
    }
}