{
    "id": "d17b6bcb-61e7-4bd3-ac49-c432cc577bbc",
    "task_name": "mcp_pandas-pivot-internal-search-001_9DdhSm",
    "trial_name": "mcp_pandas-pivot-internal-search__GGuRu9Z",
    "trial_uri": "file:///home/user/CodeContextBench/runs/staging/ccb_understand_haiku_20260227_132304/mcp-remote-direct/2026-02-27__16-58-37/mcp_pandas-pivot-internal-search__GGuRu9Z",
    "task_id": {
        "path": "/tmp/mcp_pandas-pivot-internal-search-001_9DdhSm"
    },
    "source": null,
    "task_checksum": "32f2e72d2daa047857a26ce72568e39d559c5e186e5cd867434aba34919ddfc9",
    "config": {
        "task": {
            "path": "/tmp/mcp_pandas-pivot-internal-search-001_9DdhSm",
            "git_url": null,
            "git_commit_id": null,
            "overwrite": false,
            "download_dir": null,
            "source": null
        },
        "trial_name": "mcp_pandas-pivot-internal-search__GGuRu9Z",
        "trials_dir": "runs/staging/ccb_understand_haiku_20260227_132304/mcp-remote-direct/2026-02-27__16-58-37",
        "timeout_multiplier": 10.0,
        "agent": {
            "name": null,
            "import_path": "agents.claude_baseline_agent:BaselineClaudeCodeAgent",
            "model_name": "anthropic/claude-haiku-4-5-20251001",
            "override_timeout_sec": null,
            "override_setup_timeout_sec": null,
            "max_timeout_sec": null,
            "kwargs": {}
        },
        "environment": {
            "type": "docker",
            "import_path": null,
            "force_build": false,
            "delete": true,
            "override_cpus": null,
            "override_memory_mb": null,
            "override_storage_mb": null,
            "override_gpus": null,
            "kwargs": {}
        },
        "verifier": {
            "override_timeout_sec": null,
            "max_timeout_sec": null,
            "disable": false
        },
        "job_id": "a91a32d3-852d-4a2d-bcf5-dd543381bbd2"
    },
    "agent_info": {
        "name": "claude-code",
        "version": "unknown",
        "model_info": {
            "name": "claude-haiku-4-5-20251001",
            "provider": "anthropic"
        }
    },
    "agent_result": {
        "n_input_tokens": 652505,
        "n_cache_tokens": 652278,
        "n_output_tokens": 3350,
        "cost_usd": null,
        "rollout_details": null,
        "metadata": null
    },
    "verifier_result": {
        "rewards": {
            "reward": 1.0
        }
    },
    "exception_info": null,
    "started_at": "2026-02-27T16:58:37.592458",
    "finished_at": "2026-02-27T17:27:23.296936",
    "environment_setup": {
        "started_at": "2026-02-27T16:58:37.593103",
        "finished_at": "2026-02-27T17:09:46.300028"
    },
    "agent_setup": {
        "started_at": "2026-02-27T17:09:46.300061",
        "finished_at": "2026-02-27T17:13:55.003796"
    },
    "agent_execution": {
        "started_at": "2026-02-27T17:13:55.003836",
        "finished_at": "2026-02-27T17:19:21.017597"
    },
    "verifier": {
        "started_at": "2026-02-27T17:19:21.017691",
        "finished_at": "2026-02-27T17:22:28.801793"
    }
}