{
    "id": "24545d20-9aa4-4dd4-9bf7-f2e2515e529f",
    "task_name": "mcp_ccx-onboard-search-205_a9yhn5",
    "trial_name": "mcp_ccx-onboard-search-205_a9yhn__FaK5w2E",
    "trial_uri": "file:///home/user/CodeContextBench/runs/staging/ccb_mcp_onboarding_haiku_20260302_183608/mcp-remote-direct/2026-03-02__18-38-04/mcp_ccx-onboard-search-205_a9yhn__FaK5w2E",
    "task_id": {
        "path": "/tmp/mcp_ccx-onboard-search-205_a9yhn5"
    },
    "source": null,
    "task_checksum": "4e2695c7ec42134e4e7bba7684cf1dc650a792c4fc5c8f6d4d7236398bf7db5f",
    "config": {
        "task": {
            "path": "/tmp/mcp_ccx-onboard-search-205_a9yhn5",
            "git_url": null,
            "git_commit_id": null,
            "overwrite": false,
            "download_dir": null,
            "source": null
        },
        "trial_name": "mcp_ccx-onboard-search-205_a9yhn__FaK5w2E",
        "trials_dir": "runs/staging/ccb_mcp_onboarding_haiku_20260302_183608/mcp-remote-direct/2026-03-02__18-38-04",
        "timeout_multiplier": 10.0,
        "agent_timeout_multiplier": null,
        "verifier_timeout_multiplier": null,
        "agent_setup_timeout_multiplier": null,
        "environment_build_timeout_multiplier": null,
        "agent": {
            "name": null,
            "import_path": "agents.claude_baseline_agent:BaselineClaudeCodeAgent",
            "model_name": "anthropic/claude-haiku-4-5-20251001",
            "override_timeout_sec": null,
            "override_setup_timeout_sec": null,
            "max_timeout_sec": null,
            "kwargs": {},
            "env": {}
        },
        "environment": {
            "type": "daytona",
            "import_path": null,
            "force_build": false,
            "delete": true,
            "override_cpus": null,
            "override_memory_mb": null,
            "override_storage_mb": 10240,
            "override_gpus": null,
            "suppress_override_warnings": false,
            "kwargs": {}
        },
        "verifier": {
            "override_timeout_sec": null,
            "max_timeout_sec": null,
            "disable": false
        },
        "artifacts": [],
        "job_id": "575a67e2-d718-48d1-9d92-31c882d5755f"
    },
    "agent_info": {
        "name": "claude-code",
        "version": "unknown",
        "model_info": {
            "name": "claude-haiku-4-5-20251001",
            "provider": "anthropic"
        }
    },
    "agent_result": {
        "n_input_tokens": 569189,
        "n_cache_tokens": 569044,
        "n_output_tokens": 3128,
        "cost_usd": null,
        "rollout_details": null,
        "metadata": null
    },
    "verifier_result": {
        "rewards": {
            "reward": 1.0
        }
    },
    "exception_info": null,
    "started_at": "2026-03-02T18:38:04.098782Z",
    "finished_at": "2026-03-02T18:39:11.882377Z",
    "environment_setup": {
        "started_at": "2026-03-02T18:38:04.099687Z",
        "finished_at": "2026-03-02T18:38:05.067349Z"
    },
    "agent_setup": {
        "started_at": "2026-03-02T18:38:05.067387Z",
        "finished_at": "2026-03-02T18:38:20.946309Z"
    },
    "agent_execution": {
        "started_at": "2026-03-02T18:38:20.946375Z",
        "finished_at": "2026-03-02T18:38:55.489202Z"
    },
    "verifier": {
        "started_at": "2026-03-02T18:38:56.558511Z",
        "finished_at": "2026-03-02T18:39:10.697394Z"
    }
}