{
    "id": "7de80ea0-6f8d-4697-a3e7-443cbfb391bf",
    "task_name": "mcp_flink-window-late-data-fix-001_ludod6",
    "trial_name": "mcp_flink-window-late-data-fix-0__49uFmck",
    "trial_uri": "file:///home/stephanie_jarmak/CodeContextBench/runs/staging/ccb_fix_haiku_20260301_214459/mcp-remote-direct/2026-03-01__21-45-09/mcp_flink-window-late-data-fix-0__49uFmck",
    "task_id": {
        "path": "/tmp/mcp_flink-window-late-data-fix-001_ludod6"
    },
    "source": null,
    "task_checksum": "75482558eaf1b1b741e728ebbce35b11e63c6f9b4850eb576d0997a44a8c0bbf",
    "config": {
        "task": {
            "path": "/tmp/mcp_flink-window-late-data-fix-001_ludod6",
            "git_url": null,
            "git_commit_id": null,
            "overwrite": false,
            "download_dir": null,
            "source": null
        },
        "trial_name": "mcp_flink-window-late-data-fix-0__49uFmck",
        "trials_dir": "runs/staging/ccb_fix_haiku_20260301_214459/mcp-remote-direct/2026-03-01__21-45-09",
        "timeout_multiplier": 10.0,
        "agent_timeout_multiplier": null,
        "verifier_timeout_multiplier": null,
        "agent_setup_timeout_multiplier": null,
        "environment_build_timeout_multiplier": null,
        "agent": {
            "name": null,
            "import_path": "agents.claude_baseline_agent:BaselineClaudeCodeAgent",
            "model_name": "anthropic/claude-haiku-4-5-20251001",
            "override_timeout_sec": null,
            "override_setup_timeout_sec": null,
            "max_timeout_sec": null,
            "kwargs": {},
            "env": {}
        },
        "environment": {
            "type": "daytona",
            "import_path": null,
            "force_build": false,
            "delete": true,
            "override_cpus": null,
            "override_memory_mb": null,
            "override_storage_mb": 10240,
            "override_gpus": null,
            "suppress_override_warnings": false,
            "kwargs": {}
        },
        "verifier": {
            "override_timeout_sec": null,
            "max_timeout_sec": null,
            "disable": false
        },
        "artifacts": [],
        "job_id": "f171cb60-3880-4f77-acb6-91b1bf147826"
    },
    "agent_info": {
        "name": "claude-code",
        "version": "unknown",
        "model_info": {
            "name": "claude-haiku-4-5-20251001",
            "provider": "anthropic"
        }
    },
    "agent_result": {
        "n_input_tokens": 13745761,
        "n_cache_tokens": 13744987,
        "n_output_tokens": 34409,
        "cost_usd": null,
        "rollout_details": null,
        "metadata": null
    },
    "verifier_result": {
        "rewards": {
            "reward": 0.5
        }
    },
    "exception_info": null,
    "started_at": "2026-03-01T21:45:09.936162Z",
    "finished_at": "2026-03-01T21:57:43.114941Z",
    "environment_setup": {
        "started_at": "2026-03-01T21:45:09.936731Z",
        "finished_at": "2026-03-01T21:45:11.947014Z"
    },
    "agent_setup": {
        "started_at": "2026-03-01T21:45:11.947043Z",
        "finished_at": "2026-03-01T21:45:30.185154Z"
    },
    "agent_execution": {
        "started_at": "2026-03-01T21:45:30.185205Z",
        "finished_at": "2026-03-01T21:54:17.937467Z"
    },
    "verifier": {
        "started_at": "2026-03-01T21:54:21.546825Z",
        "finished_at": "2026-03-01T21:57:41.771574Z"
    }
}