{
    "id": "2ce96057-35f7-41fa-9623-a78a2a3827c2",
    "task_name": "flipt-dep-refactor-001",
    "trial_name": "flipt-dep-refactor-001__hZhQzqh",
    "trial_uri": "file:///home/stephanie_jarmak/CodeScaleBench/runs/staging/csb_sdlc_refactor_sonnet_20260308_034803/baseline-local-direct/2026-03-08__04-15-40/flipt-dep-refactor-001__hZhQzqh",
    "task_id": {
        "path": "/home/stephanie_jarmak/CodeScaleBench/configs/../benchmarks/csb_sdlc_refactor/flipt-dep-refactor-001"
    },
    "source": null,
    "task_checksum": "0faaf29d3a81c4404ec04442c0732a8c577cf98f1c09ce2bf1ade8d00ce257c5",
    "config": {
        "task": {
            "path": "/home/stephanie_jarmak/CodeScaleBench/configs/../benchmarks/csb_sdlc_refactor/flipt-dep-refactor-001",
            "git_url": null,
            "git_commit_id": null,
            "overwrite": false,
            "download_dir": null,
            "source": null
        },
        "trial_name": "flipt-dep-refactor-001__hZhQzqh",
        "trials_dir": "runs/staging/csb_sdlc_refactor_sonnet_20260308_034803/baseline-local-direct/2026-03-08__04-15-40",
        "timeout_multiplier": 10.0,
        "agent_timeout_multiplier": null,
        "verifier_timeout_multiplier": null,
        "agent_setup_timeout_multiplier": null,
        "environment_build_timeout_multiplier": null,
        "agent": {
            "name": null,
            "import_path": "agents.claude_baseline_agent:BaselineClaudeCodeAgent",
            "model_name": "anthropic/claude-sonnet-4-6",
            "override_timeout_sec": null,
            "override_setup_timeout_sec": null,
            "max_timeout_sec": null,
            "kwargs": {},
            "env": {}
        },
        "environment": {
            "type": null,
            "import_path": "ccb_harbor.daytona:GuardedDaytonaEnvironment",
            "force_build": false,
            "delete": true,
            "override_cpus": null,
            "override_memory_mb": null,
            "override_storage_mb": 10240,
            "override_gpus": null,
            "suppress_override_warnings": false,
            "kwargs": {
                "label_launcher": "run_selected_tasks.sh",
                "label_run_id": "csb_sdlc_refactor_sonnet_20260308_034803",
                "label_benchmark": "csb_sdlc_refactor",
                "label_task_id": "flipt-dep-refactor-001",
                "label_config": "baseline-local-direct",
                "label_category": "staging",
                "label_model": "anthropic/claude-sonnet-4-6",
                "label_mcp_type": "none",
                "task_source_dir": "/home/stephanie_jarmak/CodeScaleBench/configs/../benchmarks/csb_sdlc_refactor/flipt-dep-refactor-001"
            }
        },
        "verifier": {
            "override_timeout_sec": null,
            "max_timeout_sec": null,
            "disable": false
        },
        "artifacts": [],
        "job_id": "ca06fd5d-27b3-4abf-a011-000666c52418"
    },
    "agent_info": {
        "name": "claude-code",
        "version": "unknown",
        "model_info": {
            "name": "claude-sonnet-4-6",
            "provider": "anthropic"
        }
    },
    "agent_result": {
        "n_input_tokens": 2457147,
        "n_cache_tokens": 2456216,
        "n_output_tokens": 9970,
        "cost_usd": null,
        "rollout_details": null,
        "metadata": null
    },
    "verifier_result": {
        "rewards": {
            "reward": 0.5
        }
    },
    "exception_info": null,
    "started_at": "2026-03-08T04:15:40.131150Z",
    "finished_at": "2026-03-08T04:35:46.656491Z",
    "environment_setup": {
        "started_at": "2026-03-08T04:15:40.131990Z",
        "finished_at": "2026-03-08T04:15:41.394405Z"
    },
    "agent_setup": {
        "started_at": "2026-03-08T04:15:41.394435Z",
        "finished_at": "2026-03-08T04:15:57.595923Z"
    },
    "agent_execution": {
        "started_at": "2026-03-08T04:15:57.595976Z",
        "finished_at": "2026-03-08T04:28:05.238633Z"
    },
    "verifier": {
        "started_at": "2026-03-08T04:28:06.409081Z",
        "finished_at": "2026-03-08T04:35:45.416876Z"
    }
}