{
    "id": "c8038c5d-0ca9-4e36-947e-140c20ba2e90",
    "task_name": "sgonly_flipt-transitive-deps-001",
    "trial_name": "sgonly_flipt-transitive-deps-001__T66h4C2",
    "trial_uri": "file:///home/stephanie_jarmak/CodeContextBench/runs/staging/design_haiku_20260301_022406/mcp-remote-direct/ccb_design_flipt-transitive-deps-001_mcp-remote-direct/sgonly_flipt-transitive-deps-001__T66h4C2",
    "task_id": {
        "path": "/tmp/sgonly_flipt-transitive-deps-001"
    },
    "source": null,
    "task_checksum": "f14ef012bbc5c856a5eb228d199c3c7449717311dc51e53aaa927fe72f199efc",
    "config": {
        "task": {
            "path": "/tmp/sgonly_flipt-transitive-deps-001",
            "git_url": null,
            "git_commit_id": null,
            "overwrite": false,
            "download_dir": null,
            "source": null
        },
        "trial_name": "sgonly_flipt-transitive-deps-001__T66h4C2",
        "trials_dir": "runs/staging/design_haiku_20260301_022406/mcp-remote-direct/ccb_design_flipt-transitive-deps-001_mcp-remote-direct",
        "timeout_multiplier": 10.0,
        "agent_timeout_multiplier": null,
        "verifier_timeout_multiplier": null,
        "agent_setup_timeout_multiplier": null,
        "environment_build_timeout_multiplier": null,
        "agent": {
            "name": null,
            "import_path": "agents.claude_baseline_agent:BaselineClaudeCodeAgent",
            "model_name": "anthropic/claude-haiku-4-5-20251001",
            "override_timeout_sec": null,
            "override_setup_timeout_sec": null,
            "max_timeout_sec": null,
            "kwargs": {},
            "env": {}
        },
        "environment": {
            "type": "daytona",
            "import_path": null,
            "force_build": false,
            "delete": true,
            "override_cpus": null,
            "override_memory_mb": null,
            "override_storage_mb": 10240,
            "override_gpus": null,
            "suppress_override_warnings": false,
            "kwargs": {}
        },
        "verifier": {
            "override_timeout_sec": null,
            "max_timeout_sec": null,
            "disable": false
        },
        "artifacts": [],
        "job_id": "a7189974-0674-4735-9e17-ca0bad84ff51"
    },
    "agent_info": {
        "name": "claude-code",
        "version": "unknown",
        "model_info": {
            "name": "claude-haiku-4-5-20251001",
            "provider": "anthropic"
        }
    },
    "agent_result": {
        "n_input_tokens": 3988377,
        "n_cache_tokens": 3987738,
        "n_output_tokens": 8504,
        "cost_usd": null,
        "rollout_details": null,
        "metadata": null
    },
    "verifier_result": {
        "rewards": {
            "reward": 0.711111111111111
        }
    },
    "exception_info": null,
    "started_at": "2026-03-01T02:31:24.629478Z",
    "finished_at": "2026-03-01T02:34:13.650723Z",
    "environment_setup": {
        "started_at": "2026-03-01T02:31:24.630609Z",
        "finished_at": "2026-03-01T02:32:03.787143Z"
    },
    "agent_setup": {
        "started_at": "2026-03-01T02:32:03.787187Z",
        "finished_at": "2026-03-01T02:32:28.601555Z"
    },
    "agent_execution": {
        "started_at": "2026-03-01T02:32:28.601609Z",
        "finished_at": "2026-03-01T02:34:02.660708Z"
    },
    "verifier": {
        "started_at": "2026-03-01T02:34:07.662684Z",
        "finished_at": "2026-03-01T02:34:12.179509Z"
    }
}