{
    "id": "1d36bc78-bdc5-4450-969c-eadb97aae482",
    "task_name": "mcp_terraform-code-review-001_066e0f1f",
    "trial_name": "mcp_terraform-code-review-001_06__edqCAPM",
    "trial_uri": "file:///home/stephanie_jarmak/CodeScaleBench/runs/staging/openhands_sonnet46_20260311_174751/mcp-remote-direct/2026-03-11__18-21-32/mcp_terraform-code-review-001_06__edqCAPM",
    "task_id": {
        "path": "/tmp/mcp_terraform-code-review-001_066e0f1f"
    },
    "source": null,
    "task_checksum": "363760b44c18c3b20d8360c50d2fac2a7444790a429cbe66fd17abde83e566fd",
    "config": {
        "task": {
            "path": "/tmp/mcp_terraform-code-review-001_066e0f1f",
            "git_url": null,
            "git_commit_id": null,
            "overwrite": false,
            "download_dir": null,
            "source": null
        },
        "trial_name": "mcp_terraform-code-review-001_06__edqCAPM",
        "trials_dir": "runs/staging/openhands_sonnet46_20260311_174751/mcp-remote-direct/2026-03-11__18-21-32",
        "timeout_multiplier": 10.0,
        "agent_timeout_multiplier": null,
        "verifier_timeout_multiplier": null,
        "agent_setup_timeout_multiplier": null,
        "environment_build_timeout_multiplier": null,
        "agent": {
            "name": null,
            "import_path": "agents.harnesses.openhands:OpenHandsHarnessAgent",
            "model_name": "anthropic/claude-sonnet-4-6",
            "override_timeout_sec": null,
            "override_setup_timeout_sec": null,
            "max_timeout_sec": null,
            "kwargs": {},
            "env": {}
        },
        "environment": {
            "type": null,
            "import_path": "ccb_harbor.daytona:GuardedDaytonaEnvironment",
            "force_build": false,
            "delete": true,
            "override_cpus": null,
            "override_memory_mb": null,
            "override_storage_mb": 10240,
            "override_gpus": null,
            "suppress_override_warnings": false,
            "kwargs": {
                "label_launcher": "openhands_2config.sh",
                "label_run_id": "openhands_sonnet46_20260311_174751",
                "label_benchmark": "csb_sdlc_test",
                "label_task_id": "terraform-code-review-001",
                "label_config": "mcp-remote-direct",
                "label_category": "staging",
                "label_model": "anthropic/claude-sonnet-4-6",
                "label_mcp_type": "sourcegraph_full",
                "task_source_dir": "/tmp/mcp_terraform-code-review-001_066e0f1f"
            }
        },
        "verifier": {
            "override_timeout_sec": null,
            "max_timeout_sec": null,
            "disable": false
        },
        "artifacts": [],
        "job_id": "989ded94-ece4-4829-98e4-bf493162ad9a"
    },
    "agent_info": {
        "name": "openhands",
        "version": "unknown",
        "model_info": {
            "name": "claude-sonnet-4-6",
            "provider": "anthropic"
        }
    },
    "agent_result": {
        "n_input_tokens": 4619746,
        "n_cache_tokens": 4248695,
        "n_output_tokens": 103292,
        "cost_usd": 4.197152249999999,
        "rollout_details": null,
        "metadata": null
    },
    "verifier_result": {
        "rewards": {
            "reward": 0.39
        }
    },
    "exception_info": null,
    "started_at": "2026-03-11T18:21:32.610151Z",
    "finished_at": "2026-03-11T18:52:38.983092Z",
    "environment_setup": {
        "started_at": "2026-03-11T18:21:32.611252Z",
        "finished_at": "2026-03-11T18:21:34.578812Z"
    },
    "agent_setup": {
        "started_at": "2026-03-11T18:21:34.578841Z",
        "finished_at": "2026-03-11T18:22:23.414003Z"
    },
    "agent_execution": {
        "started_at": "2026-03-11T18:22:23.414056Z",
        "finished_at": "2026-03-11T18:52:27.456247Z"
    },
    "verifier": {
        "started_at": "2026-03-11T18:52:32.913704Z",
        "finished_at": "2026-03-11T18:52:37.783283Z"
    }
}