{
    "id": "7df2bbc6-aa9f-4eb3-ad9b-d313fcca3d9e",
    "task_name": "ccx-incident-110",
    "trial_name": "ccx-incident-110__QvcTZXB",
    "trial_uri": "file:///home/stephanie_jarmak/CodeContextBench/runs/staging/ccb_mcp_incident_haiku_20260226_145828/baseline-local-direct/2026-02-26__15-04-18/ccx-incident-110__QvcTZXB",
    "task_id": {
        "path": "/home/stephanie_jarmak/CodeContextBench/configs/../benchmarks/ccb_mcp_incident/ccx-incident-110"
    },
    "source": null,
    "task_checksum": "349a322f23630ba278f24195b8048516ea5be8d517b80dc68d9a18f1280c2b44",
    "config": {
        "task": {
            "path": "/home/stephanie_jarmak/CodeContextBench/configs/../benchmarks/ccb_mcp_incident/ccx-incident-110",
            "git_url": null,
            "git_commit_id": null,
            "overwrite": false,
            "download_dir": null,
            "source": null
        },
        "trial_name": "ccx-incident-110__QvcTZXB",
        "trials_dir": "runs/staging/ccb_mcp_incident_haiku_20260226_145828/baseline-local-direct/2026-02-26__15-04-18",
        "timeout_multiplier": 10.0,
        "agent": {
            "name": null,
            "import_path": "agents.claude_baseline_agent:BaselineClaudeCodeAgent",
            "model_name": "anthropic/claude-haiku-4-5-20251001",
            "override_timeout_sec": null,
            "override_setup_timeout_sec": null,
            "max_timeout_sec": null,
            "kwargs": {}
        },
        "environment": {
            "type": "docker",
            "import_path": null,
            "force_build": false,
            "delete": true,
            "override_cpus": null,
            "override_memory_mb": null,
            "override_storage_mb": null,
            "override_gpus": null,
            "kwargs": {}
        },
        "verifier": {
            "override_timeout_sec": null,
            "max_timeout_sec": null,
            "disable": false
        },
        "job_id": "73f7f728-d913-4bb1-b692-95010c758bfe"
    },
    "agent_info": {
        "name": "claude-code",
        "version": "unknown",
        "model_info": {
            "name": "claude-haiku-4-5-20251001",
            "provider": "anthropic"
        }
    },
    "agent_result": {
        "n_input_tokens": 704870,
        "n_cache_tokens": 704510,
        "n_output_tokens": 3215,
        "cost_usd": null,
        "rollout_details": null,
        "metadata": null
    },
    "verifier_result": {
        "rewards": {
            "reward": 0.9231
        }
    },
    "exception_info": null,
    "started_at": "2026-02-26T15:04:18.538456",
    "finished_at": "2026-02-26T15:06:48.077179",
    "environment_setup": {
        "started_at": "2026-02-26T15:04:18.539450",
        "finished_at": "2026-02-26T15:05:27.200609"
    },
    "agent_setup": {
        "started_at": "2026-02-26T15:05:27.200637",
        "finished_at": "2026-02-26T15:05:51.364210"
    },
    "agent_execution": {
        "started_at": "2026-02-26T15:05:51.364244",
        "finished_at": "2026-02-26T15:06:35.115181"
    },
    "verifier": {
        "started_at": "2026-02-26T15:06:35.115246",
        "finished_at": "2026-02-26T15:06:35.331906"
    }
}