{
    "id": "9c7c5b7d-bd6a-4a5d-b77a-1e3343868963",
    "task_name": "sgonly_grafana-table-panel-regression-001",
    "trial_name": "sgonly_grafana-table-panel-regre__z5t2HgY",
    "trial_uri": "file:///home/stephanie_jarmak/CodeContextBench/runs/staging/debug_haiku_20260223_154724/mcp-remote-direct/ccb_debug_grafana-table-panel-regression-001_mcp-remote-direct/sgonly_grafana-table-panel-regre__z5t2HgY",
    "task_id": {
        "path": "/tmp/sgonly_grafana-table-panel-regression-001"
    },
    "source": null,
    "task_checksum": "ebc9981346f77c71025be4572968d23830e7a043573603d419332fead7c953cd",
    "config": {
        "task": {
            "path": "/tmp/sgonly_grafana-table-panel-regression-001",
            "git_url": null,
            "git_commit_id": null,
            "overwrite": false,
            "download_dir": null,
            "source": null
        },
        "trial_name": "sgonly_grafana-table-panel-regre__z5t2HgY",
        "trials_dir": "runs/staging/debug_haiku_20260223_154724/mcp-remote-direct/ccb_debug_grafana-table-panel-regression-001_mcp-remote-direct",
        "timeout_multiplier": 10.0,
        "agent": {
            "name": null,
            "import_path": "agents.claude_baseline_agent:BaselineClaudeCodeAgent",
            "model_name": "anthropic/claude-haiku-4-5-20251001",
            "override_timeout_sec": null,
            "override_setup_timeout_sec": null,
            "max_timeout_sec": null,
            "kwargs": {}
        },
        "environment": {
            "type": "docker",
            "import_path": null,
            "force_build": false,
            "delete": true,
            "override_cpus": null,
            "override_memory_mb": null,
            "override_storage_mb": null,
            "override_gpus": null,
            "kwargs": {}
        },
        "verifier": {
            "override_timeout_sec": null,
            "max_timeout_sec": null,
            "disable": false
        },
        "job_id": "6a734fc7-54c5-4d6a-b6ab-2138e7d62b7c"
    },
    "agent_info": {
        "name": "claude-code",
        "version": "unknown",
        "model_info": {
            "name": "claude-haiku-4-5-20251001",
            "provider": "anthropic"
        }
    },
    "agent_result": {
        "n_input_tokens": 1839708,
        "n_cache_tokens": 1839363,
        "n_output_tokens": 67,
        "cost_usd": null,
        "rollout_details": null,
        "metadata": null
    },
    "verifier_result": {
        "rewards": {
            "reward": 0.9
        }
    },
    "exception_info": null,
    "started_at": "2026-02-23T15:53:56.375363",
    "finished_at": "2026-02-23T15:56:42.509500",
    "environment_setup": {
        "started_at": "2026-02-23T15:53:56.376098",
        "finished_at": "2026-02-23T15:53:58.400342"
    },
    "agent_setup": {
        "started_at": "2026-02-23T15:53:58.400372",
        "finished_at": "2026-02-23T15:54:34.839345"
    },
    "agent_execution": {
        "started_at": "2026-02-23T15:54:34.839381",
        "finished_at": "2026-02-23T15:56:24.063239"
    },
    "verifier": {
        "started_at": "2026-02-23T15:56:24.063304",
        "finished_at": "2026-02-23T15:56:24.638217"
    }
}