{
    "id": "b5ab36f8-1369-48ac-9ba6-641b218d7684",
    "task_name": "ccx-domain-156",
    "trial_name": "ccx-domain-156__tBP6Bqc",
    "trial_uri": "file:///home/stephanie_jarmak/CodeScaleBench/runs/staging/csb_org_domain_sonnet_20260308_034803/baseline-local-direct/2026-03-08__03-53-17/ccx-domain-156__tBP6Bqc",
    "task_id": {
        "path": "/home/stephanie_jarmak/CodeScaleBench/configs/../benchmarks/csb_org_domain/ccx-domain-156"
    },
    "source": null,
    "task_checksum": "f56d15f4d482d64b16a6d60b6d9c842dfba7bcbc36ff008b49237d7295b92139",
    "config": {
        "task": {
            "path": "/home/stephanie_jarmak/CodeScaleBench/configs/../benchmarks/csb_org_domain/ccx-domain-156",
            "git_url": null,
            "git_commit_id": null,
            "overwrite": false,
            "download_dir": null,
            "source": null
        },
        "trial_name": "ccx-domain-156__tBP6Bqc",
        "trials_dir": "runs/staging/csb_org_domain_sonnet_20260308_034803/baseline-local-direct/2026-03-08__03-53-17",
        "timeout_multiplier": 10.0,
        "agent_timeout_multiplier": null,
        "verifier_timeout_multiplier": null,
        "agent_setup_timeout_multiplier": null,
        "environment_build_timeout_multiplier": null,
        "agent": {
            "name": null,
            "import_path": "agents.claude_baseline_agent:BaselineClaudeCodeAgent",
            "model_name": "anthropic/claude-sonnet-4-6",
            "override_timeout_sec": null,
            "override_setup_timeout_sec": null,
            "max_timeout_sec": null,
            "kwargs": {},
            "env": {}
        },
        "environment": {
            "type": null,
            "import_path": "ccb_harbor.daytona:GuardedDaytonaEnvironment",
            "force_build": false,
            "delete": true,
            "override_cpus": null,
            "override_memory_mb": null,
            "override_storage_mb": 10240,
            "override_gpus": null,
            "suppress_override_warnings": false,
            "kwargs": {
                "label_launcher": "run_selected_tasks.sh",
                "label_run_id": "csb_org_domain_sonnet_20260308_034803",
                "label_benchmark": "csb_org_domain",
                "label_task_id": "ccx-domain-156",
                "label_config": "baseline-local-direct",
                "label_category": "staging",
                "label_model": "anthropic/claude-sonnet-4-6",
                "label_mcp_type": "none",
                "task_source_dir": "/home/stephanie_jarmak/CodeScaleBench/configs/../benchmarks/csb_org_domain/ccx-domain-156"
            }
        },
        "verifier": {
            "override_timeout_sec": null,
            "max_timeout_sec": null,
            "disable": false
        },
        "artifacts": [],
        "job_id": "eb405e30-4dbe-4d75-8ddd-e21694b14eb4"
    },
    "agent_info": {
        "name": "claude-code",
        "version": "unknown",
        "model_info": {
            "name": "claude-sonnet-4-6",
            "provider": "anthropic"
        }
    },
    "agent_result": {
        "n_input_tokens": 1056909,
        "n_cache_tokens": 1054741,
        "n_output_tokens": 28184,
        "cost_usd": null,
        "rollout_details": null,
        "metadata": null
    },
    "verifier_result": {
        "rewards": {
            "reward": 0.0132
        }
    },
    "exception_info": null,
    "started_at": "2026-03-08T03:53:17.367028Z",
    "finished_at": "2026-03-08T03:58:44.317422Z",
    "environment_setup": {
        "started_at": "2026-03-08T03:53:17.368052Z",
        "finished_at": "2026-03-08T03:53:18.184343Z"
    },
    "agent_setup": {
        "started_at": "2026-03-08T03:53:18.184373Z",
        "finished_at": "2026-03-08T03:53:34.349518Z"
    },
    "agent_execution": {
        "started_at": "2026-03-08T03:53:34.349567Z",
        "finished_at": "2026-03-08T03:58:39.649491Z"
    },
    "verifier": {
        "started_at": "2026-03-08T03:58:41.157318Z",
        "finished_at": "2026-03-08T03:58:43.115518Z"
    }
}