{
    "id": "c777625d-f160-4823-b22e-7c163f314298",
    "task_name": "kafka-api-doc-gen-001",
    "trial_name": "kafka-api-doc-gen-001__V62ZpB3",
    "trial_uri": "file:///home/stephanie_jarmak/CodeScaleBench/runs/staging/csb_sdlc_document_haiku_20260303_141005/baseline-local-direct/2026-03-03__14-14-41/kafka-api-doc-gen-001__V62ZpB3",
    "task_id": {
        "path": "/home/stephanie_jarmak/CodeScaleBench/configs/../benchmarks/csb_sdlc_document/kafka-api-doc-gen-001"
    },
    "source": null,
    "task_checksum": "732c8cbef07237e9368416ec1538fbf52dff54af549c71f82edb6aeadacb7667",
    "config": {
        "task": {
            "path": "/home/stephanie_jarmak/CodeScaleBench/configs/../benchmarks/csb_sdlc_document/kafka-api-doc-gen-001",
            "git_url": null,
            "git_commit_id": null,
            "overwrite": false,
            "download_dir": null,
            "source": null
        },
        "trial_name": "kafka-api-doc-gen-001__V62ZpB3",
        "trials_dir": "runs/staging/csb_sdlc_document_haiku_20260303_141005/baseline-local-direct/2026-03-03__14-14-41",
        "timeout_multiplier": 10.0,
        "agent_timeout_multiplier": null,
        "verifier_timeout_multiplier": null,
        "agent_setup_timeout_multiplier": null,
        "environment_build_timeout_multiplier": null,
        "agent": {
            "name": null,
            "import_path": "agents.claude_baseline_agent:BaselineClaudeCodeAgent",
            "model_name": "anthropic/claude-haiku-4-5-20251001",
            "override_timeout_sec": null,
            "override_setup_timeout_sec": null,
            "max_timeout_sec": null,
            "kwargs": {},
            "env": {}
        },
        "environment": {
            "type": "daytona",
            "import_path": null,
            "force_build": false,
            "delete": true,
            "override_cpus": null,
            "override_memory_mb": null,
            "override_storage_mb": 10240,
            "override_gpus": null,
            "suppress_override_warnings": false,
            "kwargs": {}
        },
        "verifier": {
            "override_timeout_sec": null,
            "max_timeout_sec": null,
            "disable": false
        },
        "artifacts": [],
        "job_id": "b337b30a-4471-4e24-873e-82dc0e8941ee"
    },
    "agent_info": {
        "name": "claude-code",
        "version": "unknown",
        "model_info": {
            "name": "claude-haiku-4-5-20251001",
            "provider": "anthropic"
        }
    },
    "agent_result": {
        "n_input_tokens": 1047232,
        "n_cache_tokens": 1046858,
        "n_output_tokens": 17045,
        "cost_usd": null,
        "rollout_details": null,
        "metadata": null
    },
    "verifier_result": {
        "rewards": {
            "reward": 1.0
        }
    },
    "exception_info": null,
    "started_at": "2026-03-03T14:14:41.671839Z",
    "finished_at": "2026-03-03T14:17:35.032377Z",
    "environment_setup": {
        "started_at": "2026-03-03T14:14:41.672572Z",
        "finished_at": "2026-03-03T14:14:42.709795Z"
    },
    "agent_setup": {
        "started_at": "2026-03-03T14:14:42.709827Z",
        "finished_at": "2026-03-03T14:15:00.981645Z"
    },
    "agent_execution": {
        "started_at": "2026-03-03T14:15:00.981707Z",
        "finished_at": "2026-03-03T14:17:30.729959Z"
    },
    "verifier": {
        "started_at": "2026-03-03T14:17:32.072831Z",
        "finished_at": "2026-03-03T14:17:33.831512Z"
    }
}