{
    "id": "1284c612-82c5-475e-bd95-f4489e197861",
    "task_name": "bl_CCX-crossorg-121_6k8MlF",
    "trial_name": "bl_CCX-crossorg-121_6k8MlF__7CAwDVy",
    "trial_uri": "file:///home/stephanie_jarmak/CodeContextBench/runs/staging/ccb_mcp_crossorg_haiku_20260224_170834/baseline-local-artifact/2026-02-24__17-08-48/bl_CCX-crossorg-121_6k8MlF__7CAwDVy",
    "task_id": {
        "path": "/tmp/bl_CCX-crossorg-121_6k8MlF"
    },
    "source": null,
    "task_checksum": "ad7ed1b78d691b51e68d00188f4ddbd45b2664b116bea1bb4479ad56dc68822a",
    "config": {
        "task": {
            "path": "/tmp/bl_CCX-crossorg-121_6k8MlF",
            "git_url": null,
            "git_commit_id": null,
            "overwrite": false,
            "download_dir": null,
            "source": null
        },
        "trial_name": "bl_CCX-crossorg-121_6k8MlF__7CAwDVy",
        "trials_dir": "runs/staging/ccb_mcp_crossorg_haiku_20260224_170834/baseline-local-artifact/2026-02-24__17-08-48",
        "timeout_multiplier": 10.0,
        "agent": {
            "name": null,
            "import_path": "agents.claude_baseline_agent:BaselineClaudeCodeAgent",
            "model_name": "anthropic/claude-haiku-4-5-20251001",
            "override_timeout_sec": null,
            "override_setup_timeout_sec": null,
            "max_timeout_sec": null,
            "kwargs": {}
        },
        "environment": {
            "type": "docker",
            "import_path": null,
            "force_build": false,
            "delete": true,
            "override_cpus": null,
            "override_memory_mb": null,
            "override_storage_mb": null,
            "override_gpus": null,
            "kwargs": {}
        },
        "verifier": {
            "override_timeout_sec": null,
            "max_timeout_sec": null,
            "disable": false
        },
        "job_id": "713bc961-7cef-495e-91d2-d0789a529d21"
    },
    "agent_info": {
        "name": "claude-code",
        "version": "unknown",
        "model_info": {
            "name": "claude-haiku-4-5-20251001",
            "provider": "anthropic"
        }
    },
    "agent_result": {
        "n_input_tokens": 3837367,
        "n_cache_tokens": 3836584,
        "n_output_tokens": 374,
        "cost_usd": null,
        "rollout_details": null,
        "metadata": null
    },
    "verifier_result": {
        "rewards": {
            "reward": 0.0
        }
    },
    "exception_info": null,
    "started_at": "2026-02-24T17:08:48.286203",
    "finished_at": "2026-02-24T17:17:47.248681",
    "environment_setup": {
        "started_at": "2026-02-24T17:08:48.286987",
        "finished_at": "2026-02-24T17:08:49.445304"
    },
    "agent_setup": {
        "started_at": "2026-02-24T17:08:49.445333",
        "finished_at": "2026-02-24T17:09:25.991219"
    },
    "agent_execution": {
        "started_at": "2026-02-24T17:09:25.991254",
        "finished_at": "2026-02-24T17:17:27.189489"
    },
    "verifier": {
        "started_at": "2026-02-24T17:17:27.189559",
        "finished_at": "2026-02-24T17:17:27.953289"
    }
}