{
    "id": "44e00f7b-4000-4f15-a155-036194d8e0d0",
    "task_name": "mcp_CCX-agentic-127_SCa2pk",
    "trial_name": "mcp_CCX-agentic-127_SCa2pk__osYmwkC",
    "trial_uri": "file:///home/stephanie_jarmak/CodeContextBench/runs/staging/ccb_mcp_org_haiku_20260224_170834/mcp-remote-artifact/2026-02-24__17-17-17/mcp_CCX-agentic-127_SCa2pk__osYmwkC",
    "task_id": {
        "path": "/tmp/mcp_CCX-agentic-127_SCa2pk"
    },
    "source": null,
    "task_checksum": "744bb2317d229c5683c98a94503f0d25fb71183cd8107a1ee47d07b4d3f83efd",
    "config": {
        "task": {
            "path": "/tmp/mcp_CCX-agentic-127_SCa2pk",
            "git_url": null,
            "git_commit_id": null,
            "overwrite": false,
            "download_dir": null,
            "source": null
        },
        "trial_name": "mcp_CCX-agentic-127_SCa2pk__osYmwkC",
        "trials_dir": "runs/staging/ccb_mcp_org_haiku_20260224_170834/mcp-remote-artifact/2026-02-24__17-17-17",
        "timeout_multiplier": 10.0,
        "agent": {
            "name": null,
            "import_path": "agents.claude_baseline_agent:BaselineClaudeCodeAgent",
            "model_name": "anthropic/claude-haiku-4-5-20251001",
            "override_timeout_sec": null,
            "override_setup_timeout_sec": null,
            "max_timeout_sec": null,
            "kwargs": {}
        },
        "environment": {
            "type": "docker",
            "import_path": null,
            "force_build": false,
            "delete": true,
            "override_cpus": null,
            "override_memory_mb": null,
            "override_storage_mb": null,
            "override_gpus": null,
            "kwargs": {}
        },
        "verifier": {
            "override_timeout_sec": null,
            "max_timeout_sec": null,
            "disable": false
        },
        "job_id": "8d9879a3-9b1d-4fdc-a96f-8a664e1d67a7"
    },
    "agent_info": {
        "name": "claude-code",
        "version": "unknown",
        "model_info": {
            "name": "claude-haiku-4-5-20251001",
            "provider": "anthropic"
        }
    },
    "agent_result": {
        "n_input_tokens": 1361311,
        "n_cache_tokens": 1361010,
        "n_output_tokens": 51,
        "cost_usd": null,
        "rollout_details": null,
        "metadata": null
    },
    "verifier_result": {
        "rewards": {
            "reward": 0.5
        }
    },
    "exception_info": null,
    "started_at": "2026-02-24T17:17:17.269860",
    "finished_at": "2026-02-24T17:19:23.560785",
    "environment_setup": {
        "started_at": "2026-02-24T17:17:17.270804",
        "finished_at": "2026-02-24T17:17:21.860718"
    },
    "agent_setup": {
        "started_at": "2026-02-24T17:17:21.860820",
        "finished_at": "2026-02-24T17:17:53.494510"
    },
    "agent_execution": {
        "started_at": "2026-02-24T17:17:53.494543",
        "finished_at": "2026-02-24T17:19:00.129396"
    },
    "verifier": {
        "started_at": "2026-02-24T17:19:00.129457",
        "finished_at": "2026-02-24T17:19:00.393720"
    }
}