{
    "id": "4c5b4c4a-8977-4bb9-9a60-4d417f3a715d",
    "task_name": "mcp_k8s-apiserver-doc-gen-001_cbfa8271",
    "trial_name": "mcp_k8s-apiserver-doc-gen-001_cb__PLsEeWS",
    "trial_uri": "file:///home/user/CodeScaleBench/runs/staging/openhands_haiku45_20260322_120740/mcp-remote-direct/2026-03-22__12-29-40/mcp_k8s-apiserver-doc-gen-001_cb__PLsEeWS",
    "task_id": {
        "path": "/tmp/mcp_k8s-apiserver-doc-gen-001_cbfa8271"
    },
    "source": null,
    "task_checksum": "e6597eb19d770f4bb60e6591aeda174765cd778ca360fe8492580a176395f884",
    "config": {
        "task": {
            "path": "/tmp/mcp_k8s-apiserver-doc-gen-001_cbfa8271",
            "git_url": null,
            "git_commit_id": null,
            "overwrite": false,
            "download_dir": null,
            "source": null
        },
        "trial_name": "mcp_k8s-apiserver-doc-gen-001_cb__PLsEeWS",
        "trials_dir": "runs/staging/openhands_haiku45_20260322_120740/mcp-remote-direct/2026-03-22__12-29-40",
        "timeout_multiplier": 10.0,
        "agent_timeout_multiplier": null,
        "verifier_timeout_multiplier": null,
        "agent_setup_timeout_multiplier": null,
        "environment_build_timeout_multiplier": null,
        "agent": {
            "name": null,
            "import_path": "agents.harnesses.openhands:OpenHandsHarnessAgent",
            "model_name": "anthropic/claude-haiku-4-5-20251001",
            "override_timeout_sec": null,
            "override_setup_timeout_sec": null,
            "max_timeout_sec": null,
            "kwargs": {},
            "env": {}
        },
        "environment": {
            "type": null,
            "import_path": "ccb_harbor.daytona:GuardedDaytonaEnvironment",
            "force_build": false,
            "delete": true,
            "override_cpus": null,
            "override_memory_mb": null,
            "override_storage_mb": null,
            "override_gpus": null,
            "suppress_override_warnings": false,
            "kwargs": {
                "label_launcher": "openhands_2config.sh",
                "label_run_id": "openhands_haiku45_20260322_120740",
                "label_benchmark": "csb_sdlc_document",
                "label_task_id": "k8s-apiserver-doc-gen-001",
                "label_config": "mcp-remote-direct",
                "label_category": "staging",
                "label_model": "anthropic/claude-haiku-4-5-20251001",
                "label_mcp_type": "sourcegraph_full",
                "task_source_dir": "/tmp/mcp_k8s-apiserver-doc-gen-001_cbfa8271"
            }
        },
        "verifier": {
            "override_timeout_sec": null,
            "max_timeout_sec": null,
            "disable": false
        },
        "artifacts": [],
        "job_id": "53150f7d-a5c5-463e-a8f0-b84b3b49ff70"
    },
    "agent_info": {
        "name": "openhands",
        "version": "unknown",
        "model_info": {
            "name": "claude-haiku-4-5-20251001",
            "provider": "anthropic"
        }
    },
    "agent_result": {
        "n_input_tokens": 12924255,
        "n_cache_tokens": 0,
        "n_output_tokens": 133223,
        "cost_usd": 13.590369999999993,
        "rollout_details": null,
        "metadata": null
    },
    "verifier_result": {
        "rewards": {
            "reward": 0.76
        }
    },
    "exception_info": null,
    "started_at": "2026-03-22T12:29:40.751802Z",
    "finished_at": "2026-03-22T13:59:06.621489Z",
    "environment_setup": {
        "started_at": "2026-03-22T12:29:40.752696Z",
        "finished_at": "2026-03-22T12:29:41.714208Z"
    },
    "agent_setup": {
        "started_at": "2026-03-22T12:29:41.714233Z",
        "finished_at": "2026-03-22T12:30:19.623125Z"
    },
    "agent_execution": {
        "started_at": "2026-03-22T12:30:19.623174Z",
        "finished_at": "2026-03-22T13:57:05.017469Z"
    },
    "verifier": {
        "started_at": "2026-03-22T13:58:48.534488Z",
        "finished_at": "2026-03-22T13:59:05.324793Z"
    }
}